"name,""barcode"",""price""";
"PERA ERCOLINA (VENTA POR UNIDADES), VARIOS, (PESO APROXIMADO DE LA UNIDAD 95 GR),""ERCOLINA"",""0.28""";
"PERA ROCHA ( VENTA POR UNIDADES ), VARIOS, (PESO APROXIMADO DE LA UNIDAD 125 GR),""Rocha"",""0.19""";
"PLATANO CANARIO (VENTA POR UNIDADES), VARIOS, (PESO APROXIMADO DE LA UNIDAD 150 GR),""Cavendish"",""0.28""";
"AGUACATE, VARIOS, BANDEJA 3/4 U - 600 G APROX(PESO APROXIMADO DE LA UNIDAD 600 GR),""Hass"",""2.39""";
"COCO, VARIOS, 600 G APROX,""Goa"",""1.39""";
"GUACAMOLE FRESCO, VARIOS, TARRINA 200 G,""08436008521025"",""1.59""";
"KIWI VERDE (VENTA POR UNIDADES), VARIOS, GRANEL(PESO APROXIMADO DE LA UNIDAD 110 GR),""KIWI HAYWARD"",""0.32""";
"KIWI VERDE, VARIOS, BANDEJA 1 KG APROX(PESO APROXIMADO DE LA UNIDAD 1000 GR),""KIWI HAYWARD"",""2.69""";
"PIÑA NATURAL PELADA, VARIOS, BOTE 400 G APROX(PESO APROXIMADO DE LA UNIDAD 400 GR),""02105400030249"",""2.00""";
"PIÑA NATURAL (VENTA POR UNIDADES), VARIOS, (PESO APROXIMADO DE LA UNIDAD 1200 GR),""08480000031259"",""1.19""";
"SALSA MANGO PARA DIPEAR FRESCA, VARIOS, TARRINA 200 G,""08436008522015"",""1.59""";
"ARANDANO, , TARRINA 225 G,""Marana,Arana,Kirra,Kimba,Twolight"",""2.25""";
"CALABAZA A TROZOS, VARIOS, PAQUETE 510 G APROX(PESO APROXIMADO DE LA UNIDAD 510 GR),""Cacahuete"",""1.33""";
"CALABAZA CACAHUETE MEDIA PIEZA, , 1 KG APROX(PESO APROXIMADO DE LA UNIDAD 1000 GR),""Pluto"",""1.44""";
"CALABAZA CACAHUETE PIEZA ENTERA, , 2 KG APROX(PESO APROXIMADO DE LA UNIDAD 2000 GR),""Pluto"",""2.08""";
"CIRUELA ROJA (VENTA POR UNIDADES), VARIOS, GRANEL(PESO APROXIMADO DE LA UNIDAD 70 GR),""Santa Rosa";
"FRESON ***SUJETO A DISPONIBILIDAD***, VARIOS, BANDEJA 1500 G APROX(PESO APROXIMADO DE LA UNIDAD 1500 GR),""Freson"",""2.24""";
"FRESON ***SUJETO A DISPONIBILIDAD***, VARIOS, BANDEJA 1 KG APROX(PESO APROXIMADO DE LA UNIDAD 1000 GR),""Freson"",""2.29""";
"FRESON, VARIOS, BANDEJA 500 G APROX(PESO APROXIMADO DE LA UNIDAD 500 GR),""Freson"",""1.35""";
"MELON PIEL SAPO MEDIA PIEZA, VARIOS, 1,5 KG APROX(PESO APROXIMADO DE LA UNIDAD 1500 GR),""MELON PIEL DE SAPO"",""2.54""";
"MELON PIEL SAPO PIEZA ENTERA, VARIOS, 3 KG APROX(PESO APROXIMADO DE LA UNIDAD 3000 GR),""MELON PIEL DE SAPO"",""4.35""";
"MORA, SUREXPORT, BANDEJA 125 G,""08480000037046"",""1.99""";
"NISPERO, , BANDEJA 500 G APROX(PESO APROXIMADO DE LA UNIDAD 500 GR),""ALGAR"",""1.43""";
"SANDIA BAJA EN SEMILLAS MEDIA PIEZA, VARIOS, 3 KG APROX(PESO APROXIMADO DE LA UNIDAD 3000 GR),""Boston"",""3.39""";
"SANDIA BAJA EN SEMILLAS PIEZA ENTERA, VARIOS, 6 KG APROX.(PESO APROXIMADO DE LA UNIDAD 6000 GR),""Rayada"",""5.94""";
"UVA BLANCA SIN SEMILLAS, VARIOS, BANDEJA 500 G APROX(PESO APROXIMADO DE LA UNIDAD 500 GR),""AUTUMN CRISP, MELISSA, TIMPSON, MISTERY"",""2.75""";
"UVA NEGRA CON SEMILLAS, VARIOS, GRANEL (MINIMO 250 G)(PESO APROXIMADO DE LA UNIDAD 250 GR),""RED GLOBE"",""3.49""";
"UVA NEGRA SIN SEMILLAS, VARIOS, BANDEJA 500 G APROX(PESO APROXIMADO DE LA UNIDAD 500 GR),""MELODY, MINDNIGHT BEAUTY, SCARLOTTA"",""2.40""";
"ACELGAS FRESCAS, VARIOS, BOLSA 300 G,""08437004621184"",""1.00""";
"BROCOLI FLORETAS FRESCO (PARA MICROONDAS), VERDIFRESH, BOLSA 230 G,""08437004621900"",""1.20""";
"CALABACIN EN ESPIRALES FRESCO (CALAPASTA), VERDIFRESH, TARRINA 200 G,""08437013139557"",""1.45""";
"CANONIGOS, VARIOS, BOLSA 125 G,""08437004621139"",""1.19""";
"COGOLLOS CORAZONES, VARIOS, PAQUETE 6 U,""08436003304241"",""1.80""";
"COGOLLOS LECHUGA, VARIOS, PAQUETE 3 U,""08436003304234"",""1.00""";
"ENDIBIA, VARIOS, BANDEJA 500 G,""08421022123058"",""1.42""";
"ENSALADA BROTES TIERNOS (LECHUGA BATAVIA ROJA Y VERDE, LOLLO ROSSA, ESPINACA, RUCULA), VARIOS, BOLSA 100 G,""08437004621405"",""0.99""";
"ENSALADA BROTES TIERNOS MIX TAMAÑO MAXI (LECHUGA BATAVIA ROJA Y VERDE, LOLLO ROSSA, ESPINACA, RUCULA), VERDIFRESH, BOLSA 175 G,""08437013139014"",""1.70""";
"ENSALADA CALIFORNIA (ESCAROLA, RADICCHIO, CANONIGOS, NUEZ, PASAS, CEBOLLA, BACON, PICATOSTES, SALSA MIEL MOSTAZA Y TENEDOR), VERDIFRESH, TARRINA 192 G,""08437004621771"",""2.19""";
"ENSALADA CESAR (ESCAROLA RIZADA, CANONIGOS, RADICCHIO, POLLO, QUESO PARMESANO, SALSA CESAR, PICATOSTES Y TENEDOR), VERDIFRESH, TARRINA 210 G,""08437004621689"",""1.99""";
"ENSALADA DE LA CASA ( LECHUGAS VARIADAS, RÚCULA, COL LOMBARDA, ZANAHORIA, TOMATE CHERRY, MAIZ Y ACEITUNAS VERDES), VERDIFRESH, TARRINA 400 G,""08437013139106"",""1.79""";
"ENSALADA DE PATATA (PATATA COCIDA, HUEVO, ATUN, PIMIENTO ROJO, VERDE, CEBOLLA, TOMATE, ACEITE, SAL Y VINAGRE), VERDIFRESH, TARRINA 320 G,""08437013139731"",""2.75""";
"ENSALADA DUO CANONIGOS Y RUCULA, VERDIFRESH, BOLSA 100 G,""08437013139090"",""1.35""";
"ENSALADA ENSALIGHT (MEZCLA BROTES TIERNOS, RUCULA, RADICCHIO, TOMATE CHERRY, PAVO, QUESO LIGHT, FRUTOS SECOS Y VINAGRETA BALSAMICA), VERDIFRESH, TARRINA 230 G,""08437013139120"",""2.40""";
"ENSALADA ENSAPASTA (BROTES BATAVIA, HOJA ROBLE, TOMATE, PASTA ESPIRALES, PAVO Y SALSA YOGUR), VERDIFRESH, TARRINA 250 G,""08437013139748"",""2.40""";
"ENSALADA ENSATUN (LECHUGA ICEBERG, HOJA ROBLE, ZANAHORIA, TOMATE CHERRY, ATUN, MAIZ, MOZZARELLA, ACEITUNAS VERDES, ALIÑO Y TENEDOR), VERDIFRESH, TARRINA 250 G,""08437013139441"",""2.40""";
"ENSALADA FRESCA (RUCULA, ESPINACA, ESCAROLA, COL, L.ROSSA), VARIOS, BOLSA 200 G,""08437013139236"",""0.90""";
"ENSALADA GOURMET (ESCAROLA RIZADA, CANONIGO, RADICCHIO), VERDIFRESH, BOLSA 175 G,""08437008711379"",""0.99""";
"ENSALADA GOURMET MAXI (ESCAROLA RIZADA, CANONIGO, RADICCHIO), VERDIFRESH, BOLSA 300 G,""08437004621788"",""1.65""";
"ENSALADA JAMON (ICEBERG,CHERRY,JAMON Y QUESO CURADO,ROBLE VERDE, PICATOSTES,ACEITE,SAL,VINAGRE Y TENEDOR), VERDIFRESH, TARRINA 215 G,""08437013139489"",""2.40""";
"ENSALADA MIL ISLAS (LECHUGA ICEBERG,MAIZ, ZANAHORIA, SALSA ROSA ,SURIMI Y TENEDOR), VERDIFRESH, TARRINA 330 G,""08437013139083"",""2.35""";
"ENSALADA NUEVA TIERNA(LECHUGA TROCADERO,LECHUGA HOJA DE ROBLE VERDE Y LECHUGA BATAVIA ROJA), VERDIFRESH, PAQUETE 150 G,""08437013139038"",""1.15""";
"ENSALADA PRIMAVERA (RADICCHIO, ESCAROLA LISA Y RIZADA), VARIOS, BOLSA 200 G,""08437004621030"",""1.00""";
"ENSALADA QUINOA (QUINOA BLANCA, ZANAHORIA, CALABACIN, ESPINACAS, BROCOLI, COLIFLOR, PIPA CALABAZA, ALGA KOMBU, SALSA TERIYAKI Y TENEDOR), VERDIFRESH, TARRINA 240 G,""08437013139496"",""2.20""";
"ENSALADA 4 ESTACIONES (LECHUGA ICEBERG, ZANAHORIA, COL LOMBARDA), VARIOS, BOLSA 250 G,""08437008711119"",""0.60""";
"ESCAROLA CORTADA, VARIOS, BOLSA 150 G,""08437004621146"",""1.15""";
"ESPINACAS FRESCAS, VARIOS, BOLSA 300 G,""08437004621207"",""1.00""";
"GUACAMOLE FRESCO, VARIOS, TARRINA 500 G,""08436008521063"",""3.29""";
"KALE FRESCO, VARIOS, PAQUETE 200 G,""08437013139335"",""1.25""";
"LECHUGA CORAZON ICEBERG CORTADA, VERDIFRESH, BOLSA 250 G,""08437013139342"",""0.87""";
"LECHUGA CORAZON ROMANA, VARIOS, PAQUETE 2 U,""08436003304111"",""1.50""";
"LECHUGA CORAZON ROMANA, VARIOS, U,""08436003304197"",""1.0""";
"LECHUGA HOJA ROBLE, , U,""08436003304326"",""1.2""";
"LECHUGA ICEBERG, VARIOS, U,""08414243105026"",""0.8""";
"PALITOS ZANAHORIA FRESCA, HOY ME CUIDO, BOTE 180 G,""08422904015553"",""1.49""";
"PATATA BABY FRESCA (PARA MICROONDAS), HIJOLUSA, BOLSA 400 G,""Jazzy,Marilyn,Gourmandine,Annabelle, etc. Se envasan diferentes variedades dependiendo de la época del año."",""1.10""";
"PLATO HINDU (CALABACIN, COLIFLOR, BROCOLI, ZANAHORIA, ESPINACAS, ARROZ Y SALSA ESTILO HINDU) (APTO MICROONDAS), VERDIFRESH, TARRINA 400 G,""08437013139700"",""2.75""";
"PLATO ORIENTAL (PIMIENTO ROJO Y VERDE, COL LOMBARDA, ACELGAS, COL REPOLLO, MEZCLA SETAS, FIDEOS ORIENTALES Y SALSA WOK)(APTO MICROONDAS), VERDIFRESH, TARRINA 360 G,""08437013139717"",""2.75""";
"REMOLACHA COCIDA, EL CAMPO, PAQUETE 450 G,""08420695001014"",""0.75""";
"REPOLLO LISO CORTADO (MEDIA PIEZA), VARIOS, GRANEL(PESO APROXIMADO DE LA UNIDAD 650 GR),""08437014788020"",""0.85""";
"RUCULA CORTADA, VARIOS, BOLSA 50 G,""08437004621368"",""1.00""";
"VERDURA JULIANA MIX DE 7 VERDURAS FRESCO (PARA MICROONDAS), VERDIFRESH, BOLSA 400 G,""08437004621153"",""1.15""";
"VERDURA PAISANA MIX DE 4 VERDURAS FRESCO CALABACIN,CEBOLLA MORADA,PUERRO,ZANAHORIA FRESCO (PARA MICROONDAS), VERDIFRESH, BOLSA 300 G,""08437004621863"",""1.35""";
"VERDURA 3 VEGETALES MIX DE 3 VERDURAS BRÓCOLI, COLIFLOR, ZANAHORIA FRESCO (PARA MICROONDAS), VERDIFRESH, BOLSA 300 G,""08437004621535"",""1.20""";
"VERDURAS JARDINERA MIX DE 5 VERDURAS FRESCO CALABACIN,PIMIENTO ROJO Y VERDE,CEBOLLA Y PUERRO (PARA MICROONDAS), VERDIFRESH, BOLSA 400 G,""08437004621214"",""1.45""";
"VERDURAS MEDITERRANEO MIX (PIMIENTO ROJO, AMARILLO, ESPARRAGOS VERDES Y CEBOLLA MORADA), VERDIFRESH, BOLSA 300 G,""08437013139571"",""1.75""";
"WRAPIDOS TEXAS (ENSALADA,SALSA RANCHERA,POLLO TEX MEX, QUESO, 4 TORTITAS Y TENEDOR), VERDIFRESH, TARRINA 300 G,""08437013139250"",""2.60""";
"AJO PUERRO, VARIOS, PAQUETE 2 U - 900 G APROX(PESO APROXIMADO DE LA UNIDAD 900 GR),""08480000694119"",""2.06""";
"AJO SECO NEGRO PELADO, VARIOS, BOTE 85 G,""08436020510021"",""3.99""";
"AJO SECO, VARIOS, MALLA 400 G,""08421816100418"",""1.85""";
"AJO SECO, VARIOS, MALLA 250 G,""08421816100401"",""1.20""";
"AJO TIERNO, VARIOS, MANOJO 200 G,""08437002285104"",""1.39""";
"BATATA (VENTA POR UNIDADES), VARIOS, (PESO APROXIMADO DE LA UNIDAD 400 GR),""Boniato Batata"",""1.06""";
"CEBOLLA CHALOTA, TARA, MALLA 250 G,""Chalota"",""1.25""";
"CEBOLLA DULCE, VARIOS, MALLA 1 KG,""08425827051011"",""1.9""";
"CEBOLLA MORADA, TARA, MALLA 500 G,""Morada"",""1.15""";
"CEBOLLA TIERNA, VARIOS, PAQUETE 3 U,""COMETA"",""1.25""";
"CEBOLLA TUBO, VARIOS, MALLA 1 KG,""08437015552026"",""1.3""";
"CEBOLLA, VARIOS, MALLA 2 KG,""Amarilla"",""1.70""";
"CEBOLLINO FRESCO, VARIOS, BANDEJA 20 G,""Fresca culinaria"",""1.15""";
"PATATA GUARNICION, VARIOS, MALLA 1 KG,""Marilyn, Gourmandine, Annabelle, Jazzy y otras variedades según campaña"",""1.8""";
"PATATA ROJA, VARIOS, MALLA 2 KG,""Rudoph, Mozart, etc. Se envasan diferentes variedades dependiendo de la época del año"",""2.25""";
"PATATA, VARIOS, MALLA 5 KG,""Monalisa, Soprano, Caesar, Melody, Colomba, etc. Se envasan diferentes variedades dependiendo de la época del año"",""4.30""";
"PATATA, VARIOS, MALLA 3 KG,""Soprano, Caesar, Monalisa, Ambra, etc. Se envasan diferentes variedades dependiendo de la época del año"",""3.65""";
"PATATA, VARIOS, GRANEL (MINIMO 1000 G)(PESO APROXIMADO DE LA UNIDAD 1000 GR),""Soprano. Se envasan diferentes variedades dependiendo de la época del año"",""1.45""";
"CHAMPIÑON, CHAMPIÑON PORTOBELLO Y SETA SALTEADO LAMINADO FRESCO, VARIOS, BANDEJA 250 G APROX(PESO APROXIMADO DE LA UNIDAD 250 GR),""08480000696748"",""1.72""";
"CHAMPIÑON FRESCO ENTERO GRANDE, VARIOS, BANDEJA 430 G APROX(PESO APROXIMADO DE LA UNIDAD 430 GR),""08480000696724"",""1.84""";
"CHAMPIÑON FRESCO LAMINADO LAVADO CULTIVADO, VARIOS, BANDEJA 300 G APROX(PESO APROXIMADO DE LA UNIDAD 300 GR),""Agaricus bisporus"",""1.50""";
"CHAMPIÑON FRESCO (PIE CORTADO), VARIOS, BANDEJA 300 G APROX(PESO APROXIMADO DE LA UNIDAD 300 GR),""02105400696513"",""1.17""";
"CHAMPIÑON PORTOBELLO FRESCO ENTERO, VARIOS, BANDEJA 300 G APROX(PESO APROXIMADO DE LA UNIDAD 300 GR),""08480000696649"",""1.74""";
"SETA FRESCA LAMINADA, VARIOS, BANDEJA 200 G APROX(PESO APROXIMADO DE LA UNIDAD 200 GR),"""",""0.98""";
"SETA FRESCA, VARIOS, BANDEJA 200 G APROX(PESO APROXIMADO DE LA UNIDAD 200 GR),"""",""1.42""";
"SETA SHIITAKE FRESCA, VARIOS, BANDEJA 200 G APROX(PESO APROXIMADO DE LA UNIDAD 200 GR),""Lentinus edodes"",""2.45""";
"SETA Y CHAMPIÑON FRESCO AL PLATO CON PEREJIL, SETAS DEL MUNDO, BANDEJA 200 G,""08437014392616"",""2.88""";
"JUDIA VERDE PLANA, , PAQUETE 750 G,""08427603144009"",""2.50""";
"JUDIA VERDE PLANA, VARIOS, GRANEL (MINIMO 250 G)(PESO APROXIMADO DE LA UNIDAD 250 GR),""08480000698278"",""3.39""";
"JUDIA VERDE REDONDA, VARIOS, BANDEJA 500 G,""08427603130101"",""1.35""";
"PEPINO HOLANDES, VARIOS, U 400 G APROX(PESO APROXIMADO DE LA UNIDAD 400 GR),""Pepino Holandés"",""0.80""";
"PEPINO ***SUJETO A DISPONIBILIDAD***, VARIOS, MALLA 1250 G,""08427603060507"",""1.55""";
"PEPINO (VENTA POR UNIDADES), VARIOS, (PESO APROXIMADO DE LA UNIDAD 260 GR),""08480000695840"",""0.36""";
"PIMIENTO ROJO (VENTA POR UNIDADES), VARIOS, (PESO APROXIMADO DE LA UNIDAD 431 GR),""Rojo"",""0.86""";
"PIMIENTO SEMIPICANTE, VARIOS, PAQUETE 250 G,""Celta"",""1.15""";
"PIMIENTO TRICOLOR (ROJO, AMARILLO Y VERDE), VARIOS, BANDEJA 600 G,""PIMIENTO CALIFORNIA"",""1.59""";
"PIMIENTO VERDE FREIR (VENTA POR UNIDADES), , (PESO APROXIMADO DE LA UNIDAD 120 GR),""PIMIENTO ITALIANO"",""0.27""";
"PIMIENTO VERDE (VENTA POR UNIDADES), VARIOS, (PESO APROXIMADO DE LA UNIDAD 325 GR),""Verde"",""0.68""";
"TOMATE CANARIO (VENTA POR UNIDADES), VARIOS, (PESO APROXIMADO DE LA UNIDAD 120 GR),""08427603010236"",""0.15""";
"TOMATE CANARIO, VARIOS, MALLA 2 KG,""08427603252896"",""2.40""";
"TOMATE CHERRY NEGRO ***SUJETO A DISPONIBILIDAD***, VARIOS, BANDEJA 500 G,""08414243010009"",""0.99""";
"TOMATE CHERRY PERA NEGRO, , BANDEJA 300 G,""08414243015066"",""1.39""";
"TOMATE CHERRY PERA, VARIOS, PAQUETE 300 G,""08480000699275"",""0.99""";
"TOMATE CHERRY RAMA, DULCITA, BANDEJA 200 G,""08716062000606"",""1.99""";
"TOMATE CHERRY ***SUJETO A DISPONIBILIDAD***, VARIOS, BANDEJA 500 G,""TOMATE CHERRY"",""1.09""";
"TOMATE ENSALADA ENTREVERADO (VENTA POR UNIDADES), VARIOS, (PESO APROXIMADO DE LA UNIDAD 250 GR),""08480000699374"",""0.42""";
"TOMATE ENSALADA, VARIOS, BANDEJA 1 KG APROX(PESO APROXIMADO DE LA UNIDAD 1000 GR),""Tomate ensalada"",""1.65""";
"TOMATE NATURAL RALLADO, VARIOS, TARRINA 290 G,""Tomate"",""1.29""";
"TOMATE NEGRO KUMATO (VENTA POR UNIDADES), VARIOS, (PESO APROXIMADO DE LA UNIDAD 105 GR),""08480000699350"",""0.25""";
"TOMATE PERA (VENTA POR UNIDADES), VARIOS, (PESO APROXIMADO DE LA UNIDAD 90 GR),""Pera"",""0.12""";
"TOMATE PERA, VARIOS, BANDEJA 750 G APROX(PESO APROXIMADO DE LA UNIDAD 750 GR),""02105400699750"",""0.94""";
"TOMATE RAF, VARIOS, BANDEJA 450 G APROX(PESO APROXIMADO DE LA UNIDAD 450 GR),""08480000699961"",""2.11""";
"TOMATE RAMA (VENTA POR UNIDADES) ***SUJETO A DISPONIBILIDAD***, VARIOS, (PESO APROXIMADO DE LA UNIDAD 100 GR),""08480000694874"",""0.18""";
"TOMATE ROSA (VENTA POR UNIDADES), , GRANEL(PESO APROXIMADO DE LA UNIDAD 350 GR),""08480000694447"",""1.26""";
"TOMATE SECO, VARIOS, PAQUETE 80 G,""08436534685345"",""1.79""";
"ACELGAS MANOJO FRESCO, VARIOS, U 800 G,""08436003306061"",""1.70""";
"ALBAHACA FRESCA, VARIOS, BANDEJA 20 G,""Freca culinaria"",""1.15""";
"ALCACHOFA (VENTA POR UNIDADES), VARIOS, (PESO APROXIMADO DE LA UNIDAD 100 GR),""Blanca de Tudela"",""0.17""";
"APIO VERDE FRESCO, VARIOS, PAQUETE 660 G APROX(PESO APROXIMADO DE LA UNIDAD 660 GR),""08480000692757"",""1.32""";
"BERENJENA (VENTA POR UNIDADES), VARIOS, (PESO APROXIMADO DE LA UNIDAD 280 GR),""08480000693266"",""0.33""";
"BIMI, VARIOS, BANDEJA 200 G,""08436003300755"",""1.99""";
"BROCOLI (VENTA POR UNIDADES), VARIOS, (PESO APROXIMADO DE LA UNIDAD 380 GR),""Broculi"",""0.57""";
"CALABACIN BLANCO ( VENTA POR UNIDADES), , (PESO APROXIMADO DE LA UNIDAD 300 GR),""Blanco"",""0.48""";
"CALABACIN VERDE ( VENTA POR UNIDADES ), VARIOS, GRANEL(PESO APROXIMADO DE LA UNIDAD 500 GR),""08480000693389"",""0.65""";
"CEBOLLINO FRESCO, VARIOS, BANDEJA 20 G,""Fresca culinaria"",""1.15""";
"CILANTRO FRESCO, VARIOS, BANDEJA 20 G,""08480000696908"",""1.15""";
"COLIFLOR, VARIOS, PIEZA 1 KG APROX(PESO APROXIMADO DE LA UNIDAD 1000 GR),""Blanca"",""1.49""";
"ESPARRAGO VERDE FINO, VARIOS, MANOJO 300 G,""08410405000369"",""1.00""";
"ESPARRAGO VERDE GRUESO, VARIOS, MANOJO 350 G,""08410405000376"",""1.99""";
"HIERBABUENA FRESCA, VARIOS, PAQUETE 70 G,""Menta"",""1.15""";
"JENGIBRE, VARIOS, BANDEJA 200 G APROX(PESO APROXIMADO DE LA UNIDAD 200 GR),""Fresco"",""0.96""";
"MAIZ MAZORCA COCIDO 2 UN., EL CAMPO, PAQUETE 450 G,""08420695004015"",""1.15""";
"PEREJIL TROCEADO FRESCO, VARIOS, BOLSA 40 G,""08437008711010"",""0.70""";
"RABANITOS, VARIOS, PAQUETE 250 G,""08437014515053"",""1.10""";
"REPOLLO LISO, VARIOS, U 1315 G APROX(PESO APROXIMADO DE LA UNIDAD 1315 GR),""08480000692368"",""1.32""";
"VERDURA PUCHERO, VARIOS, BANDEJA 870 G APROX(PESO APROXIMADO DE LA UNIDAD 870 GR),""08480000696878"",""1.10""";
"ZANAHORIA RALLADA, VARIOS, BOLSA 150 G,""08437004621160"",""0.75""";
"ZANAHORIA, HOY ME CUIDO, PAQUETE 500 G APROX(PESO APROXIMADO DE LA UNIDAD 500 GR),""02105400695882"",""0.57""";
"ZANAHORIA, VARIOS, PAQUETE 1 KG,""08422904015218"",""0.6""";
"BIZCOCHO AZUCAR HORNO, HACENDADO, 1 U 420 G,""08480000844637"",""1.79""";
"BIZCOCHO CHOCOLATE HORNO, HACENDADO, 1 U 440 G,""08480000844729"",""2.29""";
"BIZCOCHO NUECES HORNO, HACENDADO, 1 U 430 G,""08480000844736"",""2.37""";
"BIZCOCHO SIN GLUTEN Y SIN LACTOSA HORNO, BONUN BAKERY, PAQUETE 300 G,""08425849700003"",""2.25""";
"MAGDALENA AZUCAR HORNO, HACENDADO, PAQUETE 8 U - 380 G,""08480000845443"",""1.55""";
"MAGDALENA CHOCOLATE HORNO, HACENDADO, PAQUETE 8 U - 380 G,""08480000845511"",""1.75""";
"MAGDALENA INTEGRAL SIN AZUCAR AÑADIDO HORNO, HACENDADO, PAQUETE 8 U - 280 G,""08480000840356"",""1.59""";
"MAGDALENA SIN GLUTEN Y SIN LACTOSA HORNO, BONUN BAKERY, BANDEJA 6 U - 300 G,""08425849700010"",""2.10""";
"MAGDALENA YOGUR HORNO, HACENDADO, PAQUETE 12 U - 400 G,""08480000845368"",""1.50""";
"MUFFIN CANELA Y MANZANA HORNO (VENTA POR UNIDADES), DAWN FOODS, 1 U - 83 G,""05028966034377"",""0.62""";
"MUFFIN MUESLI HORNO (VENTA POR UNIDADES), EUROPASTRY, 1 U - 110 G,""08424465815214"",""0.83""";
"MUFFIN NEGRO RELLENO HORNO (VENTA POR UNIDADES), EUROPASTRY, 1 U - 140 G,""08424465815511"",""1.05""";
"MUFFIN RELLENO CACAO HORNO (VENTA POR UNIDADES), EUROPASTRY, 1 U - 140 G,""08424465815115"",""1.05""";
"CARACOLA MINI RELLENA AL CACAO HORNO, PASTISART, BOLSA 6 U - 275 G,""02105900842496"",""1.25""";
"CROISSANT HORNO (VENTA POR UNIDADES), EUROPASTRY, 1 U - 50 G,""08424465892352"",""0.38""";
"CROISSANT MARGARINA HORNO (IDEAL PARA RELLENAR), PANAMAR, BOLSA 2 U,""08433709130990"",""1.00""";
"CROISSANT MINI MANTEQUILLA HORNO (VENTA POR UNIDADES), PANAMAR, 1 U - 20 G,""08433709124760"",""0.17""";
"CROISSANT MINI MANTEQUILLA HORNO, PANAMAR, PAQUETE 16 U - 320 G,""02105900842427"",""1.98""";
"CROISSANT RELLENO CACAO (VENTA POR UNIDADES), PASTISART, 1 U - 50 G,""08436531687991"",""0.38""";
"NAPOLITANA RELLENA CACAO HORNO, EUROPASTRY, BANDEJA 3 U,""08424465838053"",""1.45""";
"BERLINAS AZUCAR HORNO, HACENDADO, PAQUETE 4 U - 220 G,""08480000845276"",""1.20""";
"BERLINAS BAÑADAS CACAO HORNO ***BAJADA PVP***, HACENDADO, PAQUETE 4 U - 240 G,""08480000840615"",""1.20""";
"BERLINAS BAÑADAS CACAO HORNO ***TAMAÑO AHORRO***, HACENDADO, PAQUETE 8 U - 480 G,""08480000844897"",""2.00""";
"BOLLO RELLENO CREMA CACAO HORNO, HACENDADO, PAQUETE 3 U - 225 G,""08480000840752"",""1.35""";
"LAZOS HOJALDRE CREMA HORNO, EUROPASTRY, PAQUETE 2 U - 250 G,""08424465802825"",""1.90""";
"LAZOS HOJALDRE RELLENO CACAO HORNO, EUROPASTRY, PAQUETE 2 U - 250 G,""08424465825305"",""1.90""";
"PALMERA DE CACAO HORNO, HACENDADO, U - 425 G,""08480000847973"",""1.60""";
"PANECILLO CON PEPITAS DE CHOCOLATE BELGA, PANDRIKS, U - 85 G,""08718564133134"",""0.50""";
"PANECILLO MEDIAS NOCHES HORNO, PASQUIER RECONDO, PAQUETE 8 U - 280 G,""08410700000583"",""1.80""";
"PASTEL DE CREMA HORNO (HOJALDRE RELLENO DE CREMA) (VENTA POR UNIDADES), NEUHAUSER, 1 U 50 G,""05604621306708"",""0.38""";
"PESTIÑOS AZUCAR HORNO, CABEZAS RIVAS, BANDEJA 240 G,""08426435940124"",""1.99""";
"PESTIÑOS MIEL HORNO, P.ALVAREZ, BANDEJA 240 G,""08437002188702"",""1.99""";
"ROSQUILLA BAÑADAS CACAO HORNO, HACENDADO, PAQUETE 7 U - 182 G,""08480000846112"",""1.00""";
"TRENZA DE HOJALDRE RELLENA DE CREMA CON NUECES PECAN HORNO (VENTA POR UNIDADES), LANTMANNEN, 1 U - 90 G,""05701014062637"",""0.60""";
"TRENZA HOJALDRE HORNO, DON MANUEL, 1 U - 430 G,""08437011206008"",""6.50""";
"ARTESANITO HOJALDRE RELLENO (CHISTORRA, FRANKFURT, TORTILLA PATATA Y YORK QUESO), PANAMAR, BANDEJA 16 U - 400 G,""08433709130501"",""2.95""";
"ARTESANITO HOJALDRE RELLENO CHISTORRA (VENTA POR UNIDADES), PANAMAR, 1 U - 25 G,""08433709130501"",""0.19""";
"ARTESANITO HOJALDRE RELLENO FRANKFURT (VENTA POR UNIDADES), PANAMAR, 1 U - 25 G,""08433709130495"",""0.19""";
"ARTESANITO HOJALDRE RELLENO TORTILLA PATATA (VENTA POR UNIDADES), PANAMAR, 1 U - 25 G,""08433709130488"",""0.19""";
"ARTESANITO HOJALDRE RELLENO YORK Y QUESO (VENTA POR UNIDADES), PANAMAR, 1 U - 25 G,""08433709130471"",""0.19""";
"COCA SALADA DE VERDURAS HORNO (VENTA POR UNIDADES), BERLYS, 1 U - 122 G,""08435048239556"",""0.90""";
"EMPANADA ARGENTINA HORNO (VENTA POR UNIDADES), CHOUSA, 1 U - 100 G,""08424152012544"",""0.75""";
"EMPANADA ATUN HORNO (VENTA POR UNIDADES), INGAPAN, 1 U - 110 G,""08424152003115"",""0.83""";
"EMPANADA ATUN HORNO, INGAPAN, 1 U - 1119 G,""08424152007663"",""6.25""";
"EMPANADA ATUN HORNO, INGAPAN, 1 U - 500 G,""08424152008776"",""3.50""";
"EMPANADA CARNE HORNO, INGAPAN, 1 U -110 G,""08424152007670"",""0.95""";
"EMPANADA POLLO Y SETAS HORNO, INGAPAN, 1 U - 500 G,""08424152013107"",""3.50""";
"EMPANADA VERDURA HORNO (CHAMPIÑON, CALABACÍN, CEBOLLA Y PIMIENTO), DELICIAS CORUÑA, 1 U - 500 G,""08436009777377"",""2.95""";
"NAPOLITANA MIXTA (FIAMBRE CERDO Y QUESO) HORNO, EUROPASTRY, 2 U - 226 G,""08424465808308"",""1.40""";
"NAPOLITANAS MINI SALADAS SURTIDAS HORNO (ATÚN, QUESO, SOBRASADA Y PATE), PASTISART, BANDEJA 24 U - 390 G,""00000000842198"",""1.98""";
"PIZZA SALAMI Y QUESO HORNO (VENTA POR UNIDADES), BROT FACTORY, 1 U - 180 G,""08437011917317"",""1.35""";
"QUICHE JAMON Y BACON HORNO, BLOCH, 1 U - 380 G,""05425039230368"",""2.95""";
"QUICHE TRES QUESOS HORNO (VENTA POR UNIDADES), EUROPASTRY, 1 U - 146 G,""08424465602609"",""1.10""";
"BIZCOCHO AL HUEVO (DURO) INDUSTRIAL, ANGULO, PAQUETE 400 G,""08410930004009"",""1.00""";
"BIZCOCHO CHOCOLATE SIN GLUTEN INDUSTRIAL ***NOVEDAD***, HACENDADO, 1 U - 350 G,""08480000827821"",""3.80""";
"BIZCOCHO LIMON SIN GLUTEN INDUSTRIAL, HACENDADO, 1 U - 270 G,""08480000827203"",""2.90""";
"BIZCOCHO MARMOL CHOCOLATE SIN AZUCAR Y SIN LACTOSA (PRECORTADO) INDUSTRIAL, BALLARA, U 400 G,""08413248303901"",""1.95""";
"BIZCOCHO SOLETILLA INDUSTRIAL, HACENDADO, PAQUETE 300 G,""08480000820990"",""1.10""";
"BOCADITO NORMAL INDUSTRIAL, HACENDADO, PAQUETE 370 G,""08480000820952"",""0.99""";
"BOCADITOS BAÑADOS AL CACAO INDUSTRIAL, HACENDADO, PAQUETE 500 G,""08480000820983"",""1.50""";
"MAGDALENA CUADRADA INDUSTRIAL, HACENDADO, PAQUETE 380 G,""08480000824035"",""0.62""";
"MAGDALENA INTEGRAL INDUSTRIAL (0% AZUCARES AÑADIDOS), HACENDADO, PAQUETE 280 G,""08480000827616"",""1.45""";
"MAGDALENA REDONDA INDUSTRIAL, HACENDADO, PAQUETE 615 G,""08480000827586"",""0.99""";
"MAGDALENA RELLENA CHOCOLATE INDUSTRIAL, HACENDADO, PAQUETE 420 G,""08480000825735"",""1.26""";
"MAGDALENAS SIN GLUTEN INDUSTRIAL, HACENDADO, PAQUETE 6 U - 210 G,""08480000827197"",""2.70""";
"MANTECADAS INDUSTRIAL, VEGA PAS, BOLSA 520 G,""08411939182743"",""1.79""";
"MUFFIN CON PEPITAS DE CHOCOLATE, HORNO DE SAN JUAN, PAQUETE 4 U - 330 G,""08437013819008"",""1.69""";
"PASTEL MARMOL CHOCOLATE INDUSTRIAL, HACENDADO, U 400 G,""08480000829832"",""1.30""";
"SOBAOS INDUSTRIAL, HACENDADO, PAQUETE 24 U - 480 G,""08480000824042"",""1.06""";
"TARTA MANZANA NATURAL REDONDA INDUSTRIAL, FAMILY TART, U 300 G,""08437013818339"",""1.85""";
"TORTAS REDONDAS EXQUISITAS INDUSTRIAL, MARITOÑI, CAJA 450 G,""08420428000017"",""2.15""";
"VALENCIANAS INDUSTRIAL, , PAQUETE 24 U- 700 G,""08437016429792"",""1.38""";
"CROISSANT INDUSTRIAL, HACENDADO, PAQUETE 400 G,""08480000820853"",""1.00""";
"CROISSANT INTEGRAL INDUSTRIAL (0% AZUCARES AÑADIDOS), HACENDADO, PAQUETE 200 G,""08480000827609"",""1.35""";
"CROISSANT MINI BASE CHOCOLATE INDUSTRIAL, HACENDADO, PAQUETE 185 G,""08480000820792"",""0.90""";
"CROISSANT RELLENO CHOCOLATE INDUSTRIAL, HACENDADO, PAQUETE 375 G,""08480000820334"",""1.20""";
"ENSAIMADA MINI INDUSTRIAL, HACENDADO, PAQUETE 9 U - 350 G,""08480000820907"",""1.26""";
"NAPOLITANA CHOCOLATE INDUSTRIAL, HACENDADO, PAQUETE 8 U - 320 G,""08480000847188"",""1.09""";
"NAPOLITANA CREMA INDUSTRIAL, HACENDADO, PAQUETE 8 U 340 G,""08480000847195"",""1.15""";
"BOLLOS NEVADITOS, HACENDADO, CAJA 410 G,""08480000145024"",""1.67""";
"BOLLYCAO CHOCOLATE CLASIC, PANRICO, PAQUETE 4 U - 240 G,""08410022040229"",""1.85""";
"BOLLYCAO MINI, PANRICO, PAQUETE 6 U - 90 G,""08410022010888"",""1.10""";
"CORTADILLO DE CABELLO DE ANGEL INDUSTRIAL, INES ROSALES, PAQUETE 226G,""08410637113875"",""1.25""";
"CREPES RELLENOS DE CHOCOLATE Y CON LECHE FRESCA (SIN CONSERVANTES NI COLORANTES), ESPANORAC, PAQUETE 6 U -192 G,""03322680009706"",""1.09""";
"GOFRE CHOCOLATE INDUSTRIAL, PUNTO GOFRE, PACK 2 X 140 G - 280 G,""08425217000438"",""1.39""";
"GOFRE NATURAL INDUSTRIAL, PUNTO GOFRE, PACK 2 X 110 G - 220 G,""08425217000421"",""0.98""";
"PALMERA DE HUEVO HORNO, HACENDADO, 1 U - 170 G,""08480000847867"",""1.25""";
"PALMERITAS HOJALDRE INDUSTRIAL, HACENDADO, PAQUETE 270 G,""08480000829054"",""0.85""";
"PAN LECHE INDUSTRIAL, HACENDADO, PAQUETE 480 G,""08480000827562"",""1.28""";
"PANECILLO CHOCOBUNS CON PEPITAS CHOCOLATE INDUSTRIAL, HACENDADO, PAQUETE 6 U - 250 G,""08480000826091"",""1.10""";
"PASTELITO PHOSKITOS INDUSTRIAL, PHOSKITO, PAQUETE 4 U - 160 G,""08410014141200"",""2.55""";
"TORTAS BANITAS INDUSTRIAL, AGUILERA, PAQUETE 400 G,""08411420005209"",""1.15""";
"TORTAS DE ALGARROBO, C.LUPIANEZ, PAQUETE 500 G,""08437002353018"",""2.00""";
"TORTAS DE POLVORON NEVADAS DE CANELA, INES ROSALES, PAQUETE 6 U - 180 G,""08410637114117"",""1.15""";
"TORTAS INDUSTRIALES DE ACEITE SIN AZUCAR, INES ROSALES, PAQUETE 150 G,""08410637116036"",""1.80""";
"TORTAS INDUSTRIALES DE ACEITE, HACENDADO, PAQUETE 6 U - 180 G,""08480000829245"",""1.00""";
"TORTAS INDUSTRIALES DE ACEITE, INES ROSALES, PAQUETE 6 U - 180 G,""08410637112014"",""1.39""";
"TORTAS INDUSTRIALES DE ANIS, HACENDADO, PACK 3 X 4 U - 400 G,""08480000822321"",""1.09""";
"TORTITAS AMERICANAS REFRIGERADAS INDUSTRIALES, HACENDADO, PAQUETE 6 U - 198 G,""03663219004770"",""2.20""";
"BOMBON CHOCOLATE CON LECHE RELLENO DE TRUFA (CRUJIENTES), , CAJA 6 U - 65 G,""05410381006686"",""1.10""";
