"name,""barcode"",""price""";
"ACEITE OLIVA SABOR INTENSO TAPON VERDE ***BAJADA PVP PENINSULA Y BALEARES***, HACENDADO, BOTELLA 1 L,""08480000046406"",""2.7""";
"ACEITE OLIVA SABOR SUAVE TAPON ROJO ***BAJADA PVP PENINSULA Y BALEARES***, HACENDADO, BOTELLA 1 L,""08480000042408"",""2.7""";
"ACEITE OLIVA VIRGEN EXTRA TAPON NEGRO ***BAJADA PVP PENINSULA Y BALEARES***, HACENDADO, BOTELLA 1 L,""08480000047403"",""3.5""";
"ACEITE OLIVA VIRGEN EXTRA TAPON NEGRO ***BAJADA PVP PENINSULA Y BALEARES***, HACENDADO, GARRAFA 3 L,""08480000047175"",""9.97""";
"ACEITE OLIVA VIRGEN EXTRA TAPON NEGRO ***SUJETO A DISPONIBILIDAD*** ***BAJADA PVP PENINSULA Y BALEARES***, EMINENTE, GARRAFA 5 L,""08422881001495"",""14.95""";
"ACEITE OLIVA VIRGEN TAPON VERDE OSCURO, HACENDADO, BOTELLA 1 L,""08480000047496"",""3.2""";
"BEBIDA ESPIRITUOSA CENTENARIO, TERRY, BOTELLA 1 L,""08410162011127"",""8.9""";
"MERLUZA CONGELADA NEGRA FILETE SIN PIEL ***BAJADA PVP***, MASCATO, PAQUETE 970 G PESO NETO ESCURRIDO,""08435035302577"",""5.95""";
"POSTRE SOJA NATURAL CON COCO ***BAJADA PVP CANARIAS***, ALPRO, U - 500 G,""05411188119098"",""1.79""";
"POSTRE SOJA VAINILLA ***BAJADA PVP CANARIAS***, ALPRO, PACK 4 X 125 G - 500 G,""05411188094111"",""1.79""";
"POSTRE SOJA 2 CON MELOCOTON Y 2 PIÑA-FRUTA DE LA PASION ***BAJADA PVP CANARIAS***, ALPRO, PACK 4 X 125 G - 500 G,""05411188113416"",""1.79""";
"VINO TINTO GRAN SELECCION ***BAJADA PVP***, ARMONICO, BOTELLA 750 CC,""08436033846100"",""2.19""";
"ALMEJA BLANCA DEL NORTE ***NOVEDAD***, HACENDADO, LATA 185 G ESCURRIDO 90 G,""08480000185792"",""1.50""";
"ALTRAMUCES ***NOVEDAD***, DORISOL, BOLSA PACK 3 X 165 G U - 495 G ESCURRIDO 285 G,""08413295801221"",""1.00""";
"APERITIVO SNACK DE ALGAS CON ARROZ CRUJIENTE ***NOVEDAD***, HACENDADO, PAQUETE 20 G,""08480000331380"",""1.50""";
"APERITIVO SNACK DE ALGAS CON SESAMO ***NOVEDAD***, HACENDADO, PAQUETE 30 G,""08480000331403"",""1.50""";
"BATIDO SABOR CHOCOLATE + PROTEINAS ***NOVEDAD***, HACENDADO, BRICK 330 CC,""08480000106704"",""1.20""";
"BATIDO SABOR VAINILLA + PROTEINAS ***NOVEDAD***, HACENDADO, BRICK 330 CC,""08480000166715"",""1.20""";
"BEBIDA ISOTONICA SOLUBLE SABOR LIMON PARA DEPORTISTAS ***NOVEDAD***, ENERVITSPORT, BOTE 420 G,""08007640982248"",""4.95""";
"BIZCOCHO CHOCOLATE SIN GLUTEN INDUSTRIAL ***NOVEDAD***, HACENDADO, 1 U - 350 G,""08480000827821"",""3.80""";
"CAFE CAPSULA CAFE CON LECHE (COMPATIBLE CAFETERA DOLCE GUSTO*(MARCA DE GRUPO SOCIETE DES PRODUITS NESTLE,SA. NO RELACIONADA CON COCATECH,SL)), COCATECH, PAQUETE 16 U,""08437014735079"",""3.40""";
"CAFE CAPSULA CAFE CON LECHE DESCAFEINADO(COMPATIBLE CAFETERA DOLCE GUSTO*(MARCA GRUPO SOCIETE DES PRODUITS NESTLE, SA.NO RELACIONADA CON COCATEC SL), COCATECH, PAQUETE 16 U,""08437014735093"",""3.40""";
"CAFE CAPSULA CORTADO (COMPATIBLE CAFETERA DOLCE GUSTO*(MARCA DE GRUPO SOCIETE DES PRODUITS NESTLE, SA. NO RELACIONADA CON COCATECH,SL.)), COCATECH, PAQUETE 16 U,""08437014735086"",""3.40""";
"CAFE CAPSULA CORTADO DESCAFEINADO(COMPATIBLE CAFETERA DOLCE GUSTO*(MARCA DE GRUPO SOCIETE DES PRODUITS NESTLE,SA NO RELACIONADA CON COCATECH,SL), COCATECH, PAQUETE 16 U,""08437014735109"",""3.40""";
"CAFE CAPSULA RISTRETTO NAPOLI (COMPATIBLE CAFETERA DOLCE GUSTO) ***NOVEDAD***, DOLCE GUSTO, CAJA 16 U - 128 G,""07613036562874"",""4.25""";
"CERDO LAGARTO BLANCO FILETES FRESCO ***NOVEDAD***, , BANDEJA 500 G APROX(PESO APROXIMADO DE LA UNIDAD 500 GR),""08421384106355"",""3.45""";
"CERDO SOLOMILLO ABIERTO FRESCO ***NOVEDAD***, , BANDEJA 500 G APROX(PESO APROXIMADO DE LA UNIDAD 500 GR),""08421384106331"",""4.22""";
"CERVEZA ABADÍA TOSTADA ***NOVEDAD***, HELECINE, BOTELLIN 330 CC,""05412652000225"",""1.15""";
"CERVEZA BLANCA TRIGO SUAVE ***NOVEDAD***, 1897, BOTELLIN PACK 4 X 330 CC - 1320 CC,""08480000668974"",""4.60""";
"CERVEZA FUERTE SALVATOR ***NOVEDAD***, PAULANER, BOTELLIN 330 CC,""04066600611349"",""1.20""";
"CERVEZA GRAN RESERVA GRAND CRU ***NOVEDAD***, 1897, BOTELLIN 330 CC,""08480000668455"",""1.60""";
"CERVEZA LEY PUREZA ***NOVEDAD***, KROMBACHER, BARRIL 5 L,""04008287032031"",""12.00""";
"CERVEZA PALE ALE ***NOVEDAD***, MARSTON`S, BOTELLA 500 CC,""05011348018713"",""1.60""";
"CERVEZA RADLER CON ZUMO NATURAL DE LIMON ***NOVEDAD***, STEINBURG, BOTELLA PET 1 L,""08480000667632"",""1.0""";
"CERVEZA RUBIA SIN ALCOHOL ***NOVEDAD***, STEINBURG, BOTELLA 1 L,""08480000667588"",""0.8""";
"CERVEZA RUBIA SUAVE ***NOVEDAD***, STEINBURG, BOTELLA 1 L,""08480000667854"",""0.6""";
"CERVEZA TRIGO BLANCA SABOR CEREZA ***NOVEDAD***, CHERIE, BOTELLIN 330 CC,""05412652001000"",""1.60""";
"CERVEZA TRIGO BLANCO SIN ALCOHOL 0% ***NOVEDAD***, BAVARIA, BOTELLIN 330 CC,""08714800022460"",""0.95""";
"CERVEZA TRIGO TOSTADO DUNKEL ***NOVEDAD***, PAULANER, BOTELLIN 500 CC,""04066600941972"",""1.50""";
"COLORANTE ALIMENTARIO GEL (4 COLORES PARA MASAS Y TOPPINGS), HACENDADO, CAJA 4 U - 40 G,""08480000323576"",""2.25""";
"CREPES RELLENOS DE CHOCOLATE BELGA CONGELADOS ***NOVEDAD***, HACENDADO, CAJA 6 U - 540 G,""08480000634955"",""2.98""";
"DELICIAS FIAMBRE DE POLLO Y QUESO ***NOVEDAD***, PINCHOS JOVI, BANDEJA 8 U - 290 G,""02105100043556"",""2.50""";
"HELADO TARRINA POLVITO ***NOVEDAD***, HACENDADO, TARRINA 10 RACIONES - 1 L,""08480000645081"",""2.5""";
"INFUSION FRUTOS ROJOS (BOLSITAS PIRAMIDALES) ***NOVEDAD***, HACENDADO, CAJA 20 BOLSITAS - 40 G,""08480000114044"",""1.70""";
"JAMON COCIDO EXTRA LONCHAS (RECETA ORIGINAL 1940) ***NOVEDAD***, NOEL, TARRINA 120 G,""08410783333417"",""2.25""";
"LECHE ENTERA ***NOVEDAD***, HACENDADO, MINIBRICK 6 X 200 CC - 1200 CC,""08480000107831"",""1.35""";
"LECHE SEMIDESNATADA ***NOVEDAD***, HACENDADO, MINIBRICK 6 X 200 CC - 1200 CC,""08480000107947"",""1.35""";
"MERMELADA NARANJA ***NOVEDAD***, HACENDADO, TARRO 440 G,""08480000151070"",""1.40""";
"MIEL MIL FLORES CREMOSA ***NOVEDAD***, HACENDADO, TARRO 450 G,""08480000154453"",""3.25""";
"NUGGETS PAVO CONGELADO ***NOVEDAD***, HACENDADO, PAQUETE 400 G,""08480000630070"",""2.60""";
"PALETA CURADA LONCHAS ***NOVEDAD***, MARPA, PACK 2 X 120 G - 240 G,""08437003894275"",""3.14""";
"PAN TOSTADO CON AVENA ***NOVEDAD***, FAZER, PAQUETE 180 G,""06413467357817"",""1.55""";
"PATATAS FRITAS ONDULADAS BOLETUS ***NOVEDAD***, HACENDADO, PAQUETE 150 G,""08480000336170"",""1.15""";
"PEPINILLO EN VINAGRE ***NOVEDAD***, HENGSTENBERG, TARRO 670 G. ESCURRIDO 360 G,""00000040081410"",""2.50""";
"PICATOSTES SABOR QUESO, HACENDADO, PAQUETE 100 G,""08480000826831"",""0.75""";
"PIÑA DESHIDRATADA 100 % NATURAL ***NOVEDAD***, HACENDADO, PAQUETE 50 G,""08480000334404"",""1.00""";
"POLLO CAMPO JAMONCITO FRESCO ***NOVEDAD***, , BANDEJA 800 G APROX(PESO APROXIMADO DE LA UNIDAD 800 GR),""08480000254610"",""4.12""";
"POLLO CAMPO PECHUGA ENTERA SIN HUESO FRESCO ***NOVEDAD***, , BANDEJA 2 U - 600 G APROX(PESO APROXIMADO DE LA UNIDAD 600 GR),""08412610037628"",""4.77""";
"PREPARADO PANCAKES EN POLVO ***NOVEDAD***, HACENDADO, BOTELLA 220 G,""08480000325280"",""1.50""";
"ROSADA CONGELADA ESCALOPINES SIN PIEL, MASCATO, PAQUETE 500 G PESO NETO ESCURRIDO,""08435035302812"",""6.95""";
"SALMON NORUEGO CONGELADO LOMOS ***NOVEDAD***, LEROY, PAQUETE 2 U X 125 G - 250 G,""07033352525702"",""4.89""";
"SALSA SOJA (PARA SUSHI) ***NOVEDAD***, LEROY, PAQUETE 4 MONODOSIS - 26 G,""08436550541557"",""0.90""";
"SALSA TRUFAS ***NOVEDAD***, , TARRO 80 G,""08020950004011"",""2.95""";
"SARDINA FILETE AHUMADA ***NOVEDAD***, HACENDADO, TARRINA 85 G ESCURRIDO 65 G,""08480000184368"",""1.95""";
"SUSHI ALGAS WAKAME ***NOVEDAD***, OMAKASE, BANDEJA 80 G,""08410063082530"",""3.10""";
"SUSHI BOWL CON PESCADO CRUDO (ENSALADA ARROZ, SALMÓN, PEPINO Y SALSA SUSHI) ***NOVEDAD***, OMAKASE, BANDEJA 200 G,""08410063082592"",""3.95""";
"SUSHI ENSALADA ALGA WAKAME CON SALMÓN ***NOVEDAD***, OMAKASE, BANDEJA 160 G,""08410063082608"",""4.50""";
"SUSHI GYOZAS CON PESCADO CRUDO (GAMBAS Y VERDURAS) ***NOVEDAD***, OMAKASE, BANDEJA 4 U - 80 G,""08410063082547"",""3.75""";
"SUSHI KIT (PALILLOS, SALSA WASABI, SALSA DE SOJA Y BANDEJA PARA SALSA) *NOVEDAD*, LEROY, U,""08436550541465"",""1.0""";
"SUSHI MAKIS SALMON CON PESCADO CRUDO ***NOVEDAD***, OMAKASE, BANDEJA 8 U - 100 G,""08410063082653"",""4.25""";
"SUSHI MAKIS SURTIDO VEGANO ***NOVEDAD***, OMAKASE, BANDEJA 8 U - 135 G,""08410063082639"",""4.50""";
"SUSHI NIGUIRIS LANGOSTINO COCIDO ***NOVEDAD***, OMAKASE, BANDEJA 4 U - 110 G,""08410063082578"",""3.75""";
"SUSHI NIGUIRIS SALMON CON PESCADO CRUDO ***NOVEDAD***, OMAKASE, BANDEJA 4 U - 110 G,""08410063082509"",""3.75""";
"SUSHI NIGUIRIS SURTIDO CON PESCADO CRUDO (2 SALMON, 2 ATUN Y 2 LANGOSTINO) ***NOVEDAD***, OMAKASE, BANDEJA 6 U - 165 G,""08410063082516"",""4.75""";
"SUSHI ROLL CRUNCH CON PESCADO COCIDO (SURIMI, PEPINO, CREMA QUESO Y CEBOLLA) ***NOVEDAD***, OMAKASE, BANDEJA 6 U - 115 G,""08410063082462"",""3.95""";
"SUSHI ROLL SURTIDO CON PESCADO COCIDO (2 LANGOSTINO, 2 TAMAGO Y 2 SURIMI) ***NOVEDAD***, OMAKASE, BANDEJA 6 U - 95 G,""08410063082493"",""3.95""";
"SUSHI ROLL SURTIDO CON PESCADO CRUDO (2 ATUN Y 4 SALMON) ***NOVEDAD***, OMAKASE, BANDEJA 6 U - 95 G,""08410063082486"",""3.95""";
"SUSHI ROLL SURTIDO CON PESCADO CRUDO (4 SURIMI, 8 SALMON Y 4 LANGOSTINO COCIDO) *NOVEDAD*, OMAKASE, BANDEJA 16 U - 280 G,""08410063082660"",""8.95""";
"SUSHI SASHIMI SALMON CON SESAMO BLANCO Y SALSA PONZU ***NOVEDAD***, OMAKASE, BANDEJA 116 G,""08410063082677"",""5.75""";
"SUSHI SURTIDO BENTO BOX (ENSALADA ALGA WAKAME, SURTIDO SUSHI Y TARTAR SALMON) *NOVEDAD*, OMAKASE, BANDEJA 260 G,""08410063082615"",""6.95""";
"SUSHI SURTIDO SIN GLUTEN (4 NIGIRIS, 4 ROLL, 4 MAKIS, 4 SASHIMIS) ***NOVEDAD***, OMAKASE, BANDEJA 16 U - 300 G,""08410063082622"",""9.95""";
"SUSHI SURTIDO (16 NIGUIRIS, 12 ROLL, 12 MAKIS Y 8 SASHIMIS) (ENTREGAS VIERNES, SABADOS Y VISPERAS FESTIVOS) *NOVEDAD*, OMAKASE, BANDEJA 48 U - 950 G,""08410063082523"",""31.95""";
"SUSHI SURTIDO (4 NIGIRIS, 4 ROLL, 4 MAKIS, 4 SASHIMIS) ***NOVEDAD***, OMAKASE, BANDEJA 16 U- 288 G,""08410063082479"",""8.95""";
"SUSHI TARTAR CON PESCADO CRUDO (ATUN, CEBOLLINO, CEBOLLA Y SESAMO) *NOVEDAD*, OMAKASE, BANDEJA 160 G,""08410063082585"",""5.75""";
"VINO BLANCO FRIZZANTE SIN ALCOHOL ***NOVEDAD***, DULZZE, BOTELLA 750 CC,""08480000668943"",""3.99""";
"WASABI (PARA SUSHI) ***NOVEDAD***, LEROY, PAQUETE 4 MONODOSIS - 10 G,""08436550541540"",""0.90""";
"SUSHI ALGAS WAKAME ***NOVEDAD***, OMAKASE, BANDEJA 80 G,""08410063082530"",""3.10""";
"SUSHI BOWL CON PESCADO CRUDO (ENSALADA ARROZ, SALMÓN, PEPINO Y SALSA SUSHI) ***NOVEDAD***, OMAKASE, BANDEJA 200 G,""08410063082592"",""3.95""";
"SUSHI ENSALADA ALGA WAKAME CON SALMÓN ***NOVEDAD***, OMAKASE, BANDEJA 160 G,""08410063082608"",""4.50""";
"SUSHI GYOZAS CON PESCADO CRUDO (GAMBAS Y VERDURAS) ***NOVEDAD***, OMAKASE, BANDEJA 4 U - 80 G,""08410063082547"",""3.75""";
"SUSHI MAKIS SALMON CON PESCADO CRUDO ***NOVEDAD***, OMAKASE, BANDEJA 8 U - 100 G,""08410063082653"",""4.25""";
"SUSHI MAKIS SURTIDO VEGANO ***NOVEDAD***, OMAKASE, BANDEJA 8 U - 135 G,""08410063082639"",""4.50""";
"SUSHI NIGUIRIS LANGOSTINO COCIDO ***NOVEDAD***, OMAKASE, BANDEJA 4 U - 110 G,""08410063082578"",""3.75""";
"SUSHI NIGUIRIS SALMON CON PESCADO CRUDO ***NOVEDAD***, OMAKASE, BANDEJA 4 U - 110 G,""08410063082509"",""3.75""";
"SUSHI NIGUIRIS SURTIDO CON PESCADO CRUDO (2 SALMON, 2 ATUN Y 2 LANGOSTINO) ***NOVEDAD***, OMAKASE, BANDEJA 6 U - 165 G,""08410063082516"",""4.75""";
"SUSHI ROLL CRUNCH CON PESCADO COCIDO (SURIMI, PEPINO, CREMA QUESO Y CEBOLLA) ***NOVEDAD***, OMAKASE, BANDEJA 6 U - 115 G,""08410063082462"",""3.95""";
"SUSHI ROLL SURTIDO CON PESCADO COCIDO (2 LANGOSTINO, 2 TAMAGO Y 2 SURIMI) ***NOVEDAD***, OMAKASE, BANDEJA 6 U - 95 G,""08410063082493"",""3.95""";
"SUSHI ROLL SURTIDO CON PESCADO CRUDO (2 ATUN Y 4 SALMON) ***NOVEDAD***, OMAKASE, BANDEJA 6 U - 95 G,""08410063082486"",""3.95""";
"SUSHI ROLL SURTIDO CON PESCADO CRUDO (4 SURIMI, 8 SALMON Y 4 LANGOSTINO COCIDO) *NOVEDAD*, OMAKASE, BANDEJA 16 U - 280 G,""08410063082660"",""8.95""";
"SUSHI SASHIMI SALMON CON SESAMO BLANCO Y SALSA PONZU ***NOVEDAD***, OMAKASE, BANDEJA 116 G,""08410063082677"",""5.75""";
"SUSHI SURTIDO BENTO BOX (ENSALADA ALGA WAKAME, SURTIDO SUSHI Y TARTAR SALMON) *NOVEDAD*, OMAKASE, BANDEJA 260 G,""08410063082615"",""6.95""";
"SUSHI SURTIDO SIN GLUTEN (4 NIGIRIS, 4 ROLL, 4 MAKIS, 4 SASHIMIS) ***NOVEDAD***, OMAKASE, BANDEJA 16 U - 300 G,""08410063082622"",""9.95""";
"SUSHI SURTIDO (16 NIGUIRIS, 12 ROLL, 12 MAKIS Y 8 SASHIMIS) (ENTREGAS VIERNES, SABADOS Y VISPERAS FESTIVOS) *NOVEDAD*, OMAKASE, BANDEJA 48 U - 950 G,""08410063082523"",""31.95""";
"SUSHI SURTIDO (4 NIGIRIS, 4 ROLL, 4 MAKIS, 4 SASHIMIS) ***NOVEDAD***, OMAKASE, BANDEJA 16 U- 288 G,""08410063082479"",""8.95""";
"SUSHI TARTAR CON PESCADO CRUDO (ATUN, CEBOLLINO, CEBOLLA Y SESAMO) *NOVEDAD*, OMAKASE, BANDEJA 160 G,""08410063082585"",""5.75""";
"ALGA NORI SECA (PARA HACER SUSHI), TAIKOBAN, PAQUETE 6 HOJAS - 15 G,""."",""1.50""";
"ARROZ ESPECIAL SUSHI, HACENDADO, PAQUETE 500 G,""08480000050373"",""1.25""";
"ENSALADA DE WAKAME CONGELADA, , PAQUETE 125 G,""08480000693839"",""1.25""";
"JENGIBRE MOLIDO (TAPON ROJO), HACENDADO, TARRO 49 G,""08480000341495"",""1.10""";
"SALSA SOJA (PARA SUSHI) ***NOVEDAD***, LEROY, PAQUETE 4 MONODOSIS - 26 G,""08436550541557"",""0.90""";
"SALSA SOJA SALADA, HACENDADO, BOTELLA 250 CC,""04006824005715"",""1.35""";
"SOPA INSTANTANEA MISO (CON ALGA WAKAME), , PAQUETE 3 SOBRES - 78,6 G,""08480000800572"",""1.45""";
"SUSHI KIT (PALILLOS, SALSA WASABI, SALSA DE SOJA Y BANDEJA PARA SALSA) *NOVEDAD*, LEROY, U,""08436550541465"",""1.0""";
"WASABI (PARA SUSHI) ***NOVEDAD***, LEROY, PAQUETE 4 MONODOSIS - 10 G,""08436550541540"",""0.90""";
"ACEITE DE AGUACATE, ETHNOS, BOTELLA 250 CC,""08004275080653"",""5.00""";
"ACEITE DE COCO, NAT SANNO, BOTE 450 CC,""08436542193474"",""4.50""";
"ACEITE GIRASOL TAPON AMARILLO ***TAMAÑO AHORRO***, HACENDADO, GARRAFA 5 L,""08480000040411"",""4.79""";
"ACEITE GIRASOL TAPON AMARILLO, HACENDADO, BOTELLA 1 L,""08480000040404"",""0.9""";
"ACEITE OLIVA SABOR INTENSO TAPON VERDE ***BAJADA PVP PENINSULA Y BALEARES***, HACENDADO, BOTELLA 1 L,""08480000046406"",""2.7""";
"ACEITE OLIVA SABOR INTENSO TAPON VERDE, HACENDADO, GARRAFA 5 L,""08480000046413"",""12.95""";
"ACEITE OLIVA SABOR SUAVE TAPON ROJO ***BAJADA PVP PENINSULA Y BALEARES***, HACENDADO, BOTELLA 1 L,""08480000042408"",""2.7""";
"ACEITE OLIVA SABOR SUAVE (TAPON ROJO) ***TAMAÑO AHORRO***, HACENDADO, GARRAFA 5 L,""08480000042415"",""12.95""";
"ACEITE OLIVA VIRGEN EXTRA GRAN SELECCION (TAPON DOSIFICADOR), HACENDADO, BOTELLA CRISTAL 750 CC,""08480000047069"",""3.69""";
"ACEITE OLIVA VIRGEN EXTRA MONODOSIS, HACENDADO, TARRINAS PACK 10 X 10 CC - 100 CC,""08480000047205"",""1.35""";
"ACEITE OLIVA VIRGEN EXTRA SPRAY, HACENDADO, BOTE 200 CC,""08480000047182"",""2.15""";
"ACEITE OLIVA VIRGEN EXTRA TAPON NEGRO ***BAJADA PVP PENINSULA Y BALEARES***, HACENDADO, BOTELLA 1 L,""08480000047403"",""3.5""";
"ACEITE OLIVA VIRGEN EXTRA TAPON NEGRO ***BAJADA PVP PENINSULA Y BALEARES***, HACENDADO, GARRAFA 3 L,""08480000047175"",""9.97""";
"ACEITE OLIVA VIRGEN EXTRA TAPON NEGRO ***SUJETO A DISPONIBILIDAD*** ***BAJADA PVP PENINSULA Y BALEARES***, EMINENTE, GARRAFA 5 L,""08422881001495"",""14.95""";
"ACEITE OLIVA VIRGEN EXTRA TAPON VERDE, HOJIBLANCA, BOTELLA 1 L,""08422767123167"",""4.9""";
"ACEITE OLIVA VIRGEN TAPON VERDE OSCURO, HACENDADO, GARRAFA 3 L,""08480000047113"",""8.70""";
"ACEITE OLIVA VIRGEN TAPON VERDE OSCURO, HACENDADO, BOTELLA 1 L,""08480000047496"",""3.2""";
"ACEITE SEMILLAS FREIR TAPON ROJO, HACENDADO, BOTELLA 1 L,""08480000044426"",""1.5""";
"ACEITE SEMILLAS FREIR TAPON ROJO, HACENDADO, GARRAFA 5 L,""08480000044433"",""7.15""";
"ACEITE VINAGRE Y SAL (MONODOSIS 5+5+5), MERRY, PAQUETE 100 CC,""08411831220017"",""1.32""";
"ALIÑO (ACEITE OLIVA, AJO Y PEREJIL) REFRIGERADO, HACENDADO, TARRINA 150 G,""08480000172655"",""1.20""";
"LIMON EXPRIMIDO, HACENDADO, BOTELLA 280 CC,""08480000049032"",""0.88""";
"AJO GRANULADO (TAPON ROJO), HACENDADO, TARRO 85 G,""08480000341815"",""0.67""";
"ALBAHACA (TAPON VERDE), HACENDADO, TARRO 20 G,""08480000341280"",""0.65""";
"ANIS GRANO (TAPÓN MARRON), HACENDADO, TARRO 50 G,""08480000341235"",""0.90""";
"AZAFRAN HEBRA, HACENDADO, CAJA 0.37 G,""08480000341150"",""1.60""";
"AZAFRAN MOLIDO, HACENDADO, CAJA 0.40 G,""08480000341167"",""1.55""";
"BOLSA PARA ASAR PESCADO EN SU JUGO, HACENDADO, CAJA 2 U - 28 G,""08480000374097"",""0.95""";
"BOLSA PARA ASAR POLLO AL AJO Y LIMON, HACENDADO, CAJA 2 U - 60 G,""08480000374035"",""0.95""";
"BOLSA PARA ASAR POLLO COSTILLAS Y LOMO CON HIERBAS PROVENZALES, HACENDADO, CAJA 2 U - 48 G,""08480000374028"",""0.95""";
"BOLSA PARA ASAR POLLO Y COSTILLA SABOR BARBACOA, HACENDADO, CAJA 2 U - 48 G,""08480000374141"",""0.95""";
"CANELA MOLIDA (TAPON ROJO), HACENDADO, TARRO 52 G,""08480000341778"",""0.51""";
"CANELA RAMA ( TAPÓN MARRON), HACENDADO, TARRO 18 G,""08480000341761"",""1.20""";
"CAYENA (GUINDILLA) (TAPÓN MARRON), HACENDADO, TARRO 27 G,""08480000341785"",""0.95""";
"CEBOLLA FRITA CRUJIENTE, ONION SPECIALTIES, BOTE 150 G,""08718781824402"",""0.99""";
"CEBOLLA POLVO (TAPON ROJO), HACENDADO, TARRO 60 G,""08480000341389"",""0.95""";
"CLAVO GRANO (TAPÓN MARRON), HACENDADO, TARRO 42 G,""08480000341228"",""1.10""";
"COLORANTE ALIMENTARIO SOBRES, EL AEROPLANO, CAJA 18 G,""08416200104134"",""0.75""";
"COLORANTE ALIMENTARIO SOBRES, HACENDADO, CAJA 35 G,""08480000341082"",""1.00""";
"COLORANTE ALIMENTARIO (TAPON NARANJA), HACENDADO, TARRO 85 G,""08480000341822"",""0.59""";
"COMINO GRANO (TAPÓN MARRON), HACENDADO, TARRO 56 G,""08480000341211"",""0.80""";
"COMINO MOLIDO (TAPON ROJO), HACENDADO, TARRO 58 G,""08480000341204"",""0.63""";
"CURCUMA (TAPON ROJO), HACENDADO, TARRO 60 G,""08480000341631"",""1.15""";
"CURRY (TAPON ROJO), HACENDADO, TARRO 57 G,""08480000341259"",""0.62""";
"ENELDO HOJAS (TAPON VERDE), HACENDADO, TARRO 22 G,""08480000341365"",""1.05""";
"HIERBAS PROVENZALES (TAPON VERDE), HACENDADO, TARRO 25 G,""08480000341310"",""0.70""";
"JENGIBRE MOLIDO (TAPON ROJO), HACENDADO, TARRO 49 G,""08480000341495"",""1.10""";
"LAUREL HOJA, HACENDADO, PAQUETE 12 G,""08480000194312"",""0.66""";
"NUEZ MOSCADA MOLIDA ( TAPON ROJO), HACENDADO, TARRO 58 G,""08480000341730"",""1.10""";
"ÑORAS, HACENDADO, CAJA 25 G,""08480000341136"",""0.96""";
"OREGANO (TAPON VERDE), HACENDADO, TARRO 18 G,""08480000341808"",""0.56""";
"PEREJIL (TAPON VERDE), HACENDADO, TARRO 18 G,""08480000341792"",""0.69""";
"PIMENTON DULCE VERA D.O, YUSTE 1557, LATA 75 G,""08412917002084"",""1.38""";
"PIMENTON PICANTE DE LA VERA D.O, YUSTE 1557, LATA 75 G,""08412917002565"",""1.45""";
"PIMENTON ROJO DULCE (TAPON ROJO), HACENDADO, TARRO 56 G,""08480000341846"",""0.55""";
"PIMENTON ROJO DULCE, HACENDADO, LATA 75 G,""08480000341860"",""0.90""";
"PIMENTON ROJO PICANTE (TAPON ROJO), HACENDADO, TARRO 60 G,""08480000341839"",""0.75""";
"PIMIENTA BLANCA MOLIDA (TAPON ROJO), HACENDADO, TARRO 70 G,""08480000341709"",""1.10""";
"PIMIENTA NEGRA GRANO (TAPÓN MARRON), HACENDADO, TARRO 70 G,""08480000341723"",""0.75""";
"PIMIENTA NEGRA MOLIDA (TAPON ROJO), HACENDADO, TARRO 70 G,""08480000341716"",""0.69""";
"PIMIENTA NEGRA MOLINILLO (TAPON NEGRO), HACENDADO, BOTE 65 G,""08480000341907"",""1.32""";
"PIMIENTA POPURRI MOLINILLO (TAPON NEGRO), HACENDADO, BOTE 50 G,""08480000341891"",""1.40""";
"PIMIENTO CHORICERO CONSERVA (CARNE DE PIMIENTO), EL SOL, TARRO 140 G,""08414591000356"",""1.30""";
"PIMIENTO DULCE CHORICERO, HACENDADO, CAJA 75 G,""08480000347893"",""1.95""";
"PIÑONES IBERICOS, HACENDADO, TARRO 50 G,""08480000342102"",""3.50""";
"PREPARADO PAELLA (CON AZAFRAN), HACENDADO, TARRO 76 G,""08480000347770"",""1.65""";
"ROMERO (TAPON VERDE), HACENDADO, TARRO 40 G,""08480000341754"",""0.80""";
"SAL AJO (TAPON ROJO), HACENDADO, TARRO 130 G,""08480000341303"",""1.00""";
"SALSA TRUFAS ***NOVEDAD***, , TARRO 80 G,""08020950004011"",""2.95""";
"SAZONADOR BARBACOA (TAPON AZUL), HACENDADO, TARRO 98 G,""08480000374042"",""1.40""";
"SAZONADOR BURRITO, HACENDADO, SOBRE 40 G,""08480000171474"",""0.79""";
"SAZONADOR DE PAELLA CON AZAFRAN, HACENDADO, CAJA 20 G (5 SOBRES),""08480000347022"",""1.30""";
"SAZONADOR ENSALADA (TAPON AZUL), HACENDADO, TARRO 95 G,""08480000374059"",""1.40""";
"SAZONADOR ESPAGUETI (TAPON AZUL), HACENDADO, TARRO 45 G,""08480000341341"",""1.40""";
"SAZONADOR FAJITAS, HACENDADO, SOBRE 30 G,""08480000171467"",""0.79""";
"SAZONADOR PESCADO (TAPON AZUL), HACENDADO, TARRO 95 G,""08480000374066"",""1.40""";
"SAZONADOR PINCHITOS (TAPON AZUL), HACENDADO, TARRO 70 G,""08480000374127"",""1.30""";
"SAZONADOR POLLO ASADO (TAPON AZUL), HACENDADO, TARRO 92 G,""08480000374080"",""1.05""";
"TOMILLO (TAPON VERDE), HACENDADO, TARRO 28 G,""08480000341747"",""0.69""";
"TRUFA NATURAL, DOS SRL, TARRO 12.50 G,""08020950004318"",""3.50""";
"VAINILLA RAMA, HACENDADO, 2 U,""08480000341488"",""2.50""";
"KETCHUP LIGHT, HACENDADO, BOTE 600 G,""08480000173317"",""1.00""";
"KETCHUP MONODOSIS, HACENDADO, SOBRES PACK 12 X 20 G - 240 G,""08480000173546"",""0.85""";
"KETCHUP, DEVELEY, BOTE 450 G,""04006824990967"",""1.35""";
"KETCHUP, HACENDADO, BOTE 600 G,""08480000173539"",""0.85""";
"KETCHUP, HEINZ, BOTE 570 G,""08715700017006"",""2.45""";
"MOSTAZA A LA ANTIGUA CON GRANITOS, MEDIJON, TARRO 200 G,""03563490016403"",""1.10""";
"MOSTAZA DIJON, MEDIJON, TARRO 200 G,""03563490016397"",""0.99""";
"MOSTAZA DULCE, HACENDADO, BOTE 330 G,""08480000173119"",""0.80""";
"MOSTAZA, HACENDADO, BOTE 340 G,""08480000173836"",""0.70""";
"ALLIOLI ESTILO CASERO, CHOVI, MORTERO 180 CC,""08410422005026"",""0.99""";
"ALLIOLI ESTILO CASERO, HACENDADO, TARRINA 190 G,""08480000171726"",""0.78""";
"ALLIOLI MONODOSIS, HACENDADO, SOBRES PACK 8 U - 160 G,""08480000171733"",""1.20""";
"ALLIOLI, HACENDADO, TARRO 225 G,""08480000171818"",""0.90""";
"MAYONESA, HACENDADO, TARRO ( BOCA ANCHA ) 700 CC,""08480000170828"",""1.35""";
"MAYONESA, HACENDADO, BOTE 560 G,""08480000170859"",""1.40""";
"MAYONESA, HACENDADO, SOBRES PACK 12 X 20 G - 240 G,""08480000170965"",""1.00""";
"MAYONESA, HACENDADO, TARRO 300 CC,""08480000170095"",""0.75""";
"MAYONESA, HELLMANN'S, TARRO 475 G,""08712566298297"",""1.75""";
"MAYONESA, HELLMANN'S, TARRO 208 G,""08410127050482"",""1.15""";
"SALSA LIGERA, HACENDADO, TARRO 700 CC,""08480000170835"",""1.20""";
"SALSA LIGERA, HACENDADO, BOTE 560 CC,""08480000170866"",""1.10""";
"SALSA LIGERA, LIGERESA, TARRO CRISTAL 230 G,""00000084138026"",""1.15""";
"SALSA LIGERA, LIGERESA, TARRO CRISTAL 475 G,""08712566298334"",""1.99""";
"SALSA LIGERA, LIGERESA, BOTE (BOCA ABAJO) 430 G,""08722700136224"",""1.85""";
"SALSA SIN HUEVO NI LACTOSA, MUSA, BOTE 300 CC,""08431594004471"",""1.80""";
"BICARBONATO SODICO, HACENDADO, PAQUETE 1 KG,""08480000290076"",""1.1""";
"BICARBONATO SODICO, HACENDADO, BOTE 300 G,""08480000290069"",""0.69""";
"SAL BAJA SODIO (60 % MENOS), HACENDADO, BOTE 250 G,""08480000197139"",""1.20""";
"SAL DE FRUTAS (SABOR LIMON), HACENDADO, BOTE 250 G,""08480000290168"",""1.59""";
"SAL DEL HIMALAYA MOLINILLO, HACENDADO, TARRO 110 G,""08480000197399"",""1.95""";
"SAL FINA SECA NORMAL, HACENDADO, PAQUETE 1 KG,""08480000197313"",""0.2""";
"SAL FINA SECA YODADA, HACENDADO, PAQUETE 1 KG,""08480000197320"",""0.1""";
"SAL GRUESA, HACENDADO, PAQUETE 1 KG,""08480000197337"",""0.1""";
"SAL HORNEAR, HACENDADO, PAQUETE 2 KG,""08480000197344"",""0.71""";
"SAL PARA AHUMAR, HACENDADO, BOTE 750 G,""08480000197269"",""2.00""";
"SAL SALERO NORMAL DE MESA, HACENDADO, TARRO 250 G,""08480000197153"",""0.38""";
"CURRY ROJO (CONCENTRADO EN PASTA PARA HACER SALSA), THAI FOOD KING, PAQUETE 50 G,""00084909028242"",""1.00""";
"SALSA BECHAMEL DESHIDRATADA, HACENDADO, SOBRE 43 G,""08480000175090"",""0.80""";
"SALSA CHAMPIÑONES, HACENDADO, SOBRE 31 G,""08480000175083"",""0.80""";
"SALSA PIMIENTA VERDE, HACENDADO, SOBRE 50 G,""08480000175021"",""0.75""";
"SALSA ROQUEFORT, HACENDADO, SOBRE 28 G,""08480000175151"",""0.80""";
"BECHAMEL, HACENDADO, MINIBRICK PACK 3 X 200 CC - 600 CC,""08480000102508"",""1.55""";
"MOJO ROJO PICANTE CANARIO, HACENDADO, TARRO 200 G,""08437010931444"",""1.85""";
"MOJO ROJO SUAVE CANARIO, HACENDADO, TARRO 200 G,""08437010931451"",""1.85""";
"SALSA AGRIDULCE, HACENDADO, BOTE 350 G,""08480000173348"",""0.99""";
"SALSA BARBACOA DULCE PICANTE, DEVELEY, BOTELLA 250 CC,""08480000173737"",""1.25""";
"SALSA BARBACOA, HACENDADO, BOTE 350 G,""08480000173461"",""0.99""";
"SALSA BOLOÑESA, HACENDADO, TARRO 300 G,""08480000171696"",""1.15""";
"SALSA BRAVA (MAS PICANTE), HACENDADO, BOTE 320 G,""08480000173041"",""0.82""";
"SALSA BURGER, DEVELEY, BOTE 250 CC,""04006824996686"",""1.25""";
"SALSA CAJUN (PICANTE), HACENDADO, BOTE 330 G,""08480000173874"",""1.15""";
"SALSA CESAR, HACENDADO, BOTE 310 CC,""08480000173669"",""1.15""";
"SALSA CHIMICHURRI, DEVELEY, BOTELLA 250 G,""04006824004992"",""1.25""";
"SALSA CURRY, DEVELEY, BOTE 250 CC,""04006824009492"",""1.45""";
"SALSA ESTILO ARGENTINO, HACENDADO, TARRO 285 G,""08480000170811"",""1.20""";
"SALSA MEXICANA, HACENDADO, TARRO 315 G,""08480000171702"",""1.20""";
"SALSA MIEL MOSTAZA, HACENDADO, BOTE 300 CC,""08480000172631"",""1.20""";
"SALSA NAPOLITANA, HACENDADO, TARRO 200 CC,""08480000172693"",""0.99""";
"SALSA OSTRAS, LEE KUM KEE, BOTELLA 255 G,""08480000171795"",""1.80""";
"SALSA PATATA GAJOS, DEVELEY, BOTE 250 CC,""04006824006699"",""1.25""";
"SALSA PERRINS, PERRINS, BOTELLA 150 ML,""05000111040983"",""2.70""";
"SALSA PESTO A LA GENOVESA, GARDENFOOD, TARRO 190 G,""08015559300091"",""1.25""";
"SALSA PESTO ROSSO, HACENDADO, TARRO 200 G,""08015559301500"",""1.25""";
"SALSA PICANTE EXTRA, HACENDADO, BOTELLA 100 G,""08480000172105"",""1.30""";
"SALSA QUESO, HACENDADO, TARRO 300 G,""08480000171719"",""1.25""";
"SALSA RANCHERA, DEVELEY, BOTE 250 CC,""04006824998802"",""1.25""";
"SALSA ROQUEFORT, HACENDADO, BOTE 310 G,""08480000173157"",""0.95""";
"SALSA ROSA COCKTAIL, HACENDADO, TARRO 700 CC,""08480000173140"",""1.55""";
"SALSA ROSA COCKTAIL, HACENDADO, BOTE 310 CC,""08480000173133"",""0.95""";
"SALSA SOJA DULCE, AIKO, BOTELLA 250 CC,""04006824035736"",""1.35""";
"SALSA SOJA SALADA, HACENDADO, BOTELLA 250 CC,""04006824005715"",""1.35""";
